<?xml version="1.0" encoding="UTF-8"?>

<Libreria xmlns:xsi="http://www.w3.org/2001/XMLSchema-instance" xsi:noNamespaceSchemaLocation="libreria.xsd">
    <libro>
        <ISBN>1234567890</ISBN>
        <titulo>EL Lazarillo de Tormes</titulo>
        <autor>none</autor>
        <disponible>no</disponible>
        <notas>null</notas>
    </libro>
    <libro>
        <ISBN>0987654321</ISBN>
        <titulo>Harry Potter</titulo>
        <autor>JK. Rowlin</autor>
        <disponible>s√≠</disponible>
        <notas>Ta' perfe</notas>
    </libro>
</Libreria>